{
  "schema": "yaaw.project-state/v2",
  "phase": "complete",
  "product": {"artifact": ".yaaw-core/project/product.md", "status": "ready", "revision": 3},
  "planning": {"artifact": ".yaaw-core/project/engineering.md", "status": "ready", "revision": 5, "current_frontier": "F-001", "readiness": "PASS", "active_spec": "SPEC-001", "scope_status": "COMPLETE"},
  "active_ticket": null,
  "tickets": {"TASK-001": "PASS"},
  "transition_sequence": 4,
  "last_transition": {"sequence": 4, "subject": "TASK-001", "from": "REVIEW_REQUIRED", "to": "PASS", "workflow": "review.record-review", "reason": "fresh review passed", "evidence": [".yaaw-core/project/reviews/TASK-001-R1.md", "EVIDENCE-TASK-001-V1"], "observed_commit": "abc123"},
  "blocker": null,
  "last_observed_commit": "abc123",
  "last_workflow": "review.record-review"
}
