{
  "schema": "yaaw.project-state/v2",
  "phase": "product",
  "product": {"artifact": ".yaaw-core/project/product.md", "status": "missing", "revision": 0},
  "planning": {"artifact": ".yaaw-core/project/engineering.md", "status": "missing", "revision": 0, "current_frontier": null, "readiness": "pending", "active_spec": null, "scope_status": "UNKNOWN"},
  "active_ticket": null,
  "tickets": {},
  "transition_sequence": 0,
  "last_transition": null,
  "blocker": null,
  "last_observed_commit": null,
  "last_workflow": null
}
